{
  "id": "test-beginnings",
  "identity": {
    "name": "Rachel & David Kim",
    "title": "Licensed Real Estate Brokers",
    "license_id": "NC-312456",
    "brokerage": "Hearthstone Realty Group",
    "brokerage_id": "HRG-CLT-1802",
    "phone": "(704) 555-0177",
    "office_phone": "(704) 555-0100",
    "email": "rachel@testrealty.com",
    "website": "thekimteamclt.com",
    "languages": ["English", "Korean"],
    "tagline": "Finding Your Place to Call Home",
    "headshot_url": "/agents/test-beginnings/headshot.jpg"
  },
  "location": {
    "state": "NC",
    "office_address": "200 S Tryon St, Suite 400, Charlotte, NC 28202",
    "service_areas": ["South End", "NoDa", "Plaza Midwood", "Dilworth"]
  },
  "branding": {
    "primary_color": "#2d4a3e",
    "secondary_color": "#d4a574",
    "accent_color": "#5a9e7c",
    "font_family": "Nunito",
    "logo_url": ""
  },
  "integrations": { "email_provider": "gmail" },
  "compliance": {
    "state_form": "NC-REC-2.14",
    "licensing_body": "NC Real Estate Commission",
    "disclosure_requirements": [
      "Residential Property Disclosure Statement",
      "Lead-based paint disclosure (pre-1978)",
      "Mineral and Oil Rights Disclosure"
    ]
  }
}
