{
  "id": "test-country",
  "identity": {
    "name": "James Whitfield",
    "title": "Licensed Real Estate Broker",
    "license_id": "VA-0225678",
    "brokerage": "Whitfield Land & Home",
    "brokerage_id": "WLH-VA-0701",
    "phone": "(540) 555-0144",
    "office_phone": "(540) 555-0100",
    "email": "james@testrealty.com",
    "website": "whitfieldlandhome.com",
    "languages": ["English"],
    "tagline": "Estate Properties in Virginia Horse Country",
    "headshot_url": "/agents/test-country/headshot.jpg"
  },
  "location": {
    "state": "VA",
    "office_address": "100 E Market St, Leesburg, VA 20176",
    "service_areas": ["Loudoun County", "Fauquier County", "Clarke County", "Middleburg"]
  },
  "branding": {
    "primary_color": "#2d4a3e",
    "secondary_color": "#8b6b3d",
    "accent_color": "#d4c5a0",
    "font_family": "Georgia",
    "logo_url": ""
  },
  "integrations": { "email_provider": "gmail" },
  "compliance": {
    "state_form": "VA-DPOR-400",
    "licensing_body": "VA Dept of Professional & Occupational Regulation",
    "disclosure_requirements": [
      "Residential Property Disclosure Statement",
      "Lead-based paint disclosure (pre-1978)",
      "Military Installation Disclosure"
    ]
  }
}
