{
  "id": "test-commercial",
  "identity": {
    "name": "Robert Chen",
    "title": "Senior Vice President, Commercial Real Estate",
    "license_id": "TX-654321",
    "brokerage": "Chen Commercial Group",
    "brokerage_id": "CCG-DFW-0501",
    "phone": "(214) 555-0122",
    "office_phone": "(214) 555-0100",
    "email": "robert@testrealty.com",
    "website": "chencommercial.com",
    "languages": ["English", "Mandarin"],
    "tagline": "Strategic Commercial Real Estate in DFW",
    "headshot_url": "/agents/test-commercial/headshot.jpg"
  },
  "location": {
    "state": "TX",
    "office_address": "2200 Ross Ave, Suite 3500, Dallas, TX 75201",
    "service_areas": ["Dallas", "Fort Worth", "Plano", "Irving"]
  },
  "branding": {
    "primary_color": "#1e293b",
    "secondary_color": "#334155",
    "accent_color": "#2563eb",
    "font_family": "Inter",
    "logo_url": "/agents/test-commercial/logo.png"
  },
  "integrations": { "email_provider": "gmail" },
  "compliance": {
    "state_form": "TREC-OP-H",
    "licensing_body": "TX Real Estate Commission",
    "disclosure_requirements": [
      "Seller's Disclosure Notice",
      "Environmental Disclosure",
      "Lead-based paint disclosure (pre-1978)"
    ]
  }
}
