{
  "id": "test-luxury",
  "identity": {
    "name": "Victoria Sterling",
    "title": "Licensed Associate Real Estate Broker",
    "license_id": "10491087654",
    "brokerage": "Sterling & Associates",
    "brokerage_id": "SA-NYC-0801",
    "phone": "(212) 555-0199",
    "office_phone": "(212) 555-0190",
    "email": "victoria@testrealty.com",
    "website": "victoriasterlingsells.com",
    "languages": ["English", "French"],
    "tagline": "Luxury Real Estate",
    "headshot_url": "/agents/test-luxury/headshot.jpg"
  },
  "location": {
    "state": "NY",
    "office_address": "740 Park Avenue, Suite 12A, New York, NY 10021",
    "service_areas": ["Upper East Side", "Tribeca", "SoHo", "Greenwich Village"]
  },
  "branding": {
    "primary_color": "#0a0a0a",
    "secondary_color": "#1a1a2e",
    "accent_color": "#d4af37",
    "font_family": "Georgia",
    "logo_url": "/agents/test-luxury/logo.svg"
  },
  "integrations": {
    "email_provider": "gmail"
  },
  "compliance": {
    "state_form": "NY-DOS-1736",
    "licensing_body": "NY Department of State",
    "disclosure_requirements": [
      "Property condition disclosure (PCDS)",
      "Lead-based paint disclosure (pre-1978)",
      "Smoke/CO detector compliance"
    ]
  }
}
