{
  "id": "test-light-luxury",
  "identity": {
    "name": "Isabelle Fontaine",
    "title": "Licensed Real Estate Broker",
    "license_id": "REB.0795432",
    "brokerage": "Fontaine & Partners",
    "brokerage_id": "FP-CT-0901",
    "phone": "(203) 555-0166",
    "office_phone": "(203) 555-0100",
    "email": "isabelle@testrealty.com",
    "website": "isabellefontaine.com",
    "languages": ["English", "French"],
    "tagline": "Refined Living in Fairfield County",
    "headshot_url": "/agents/test-light-luxury/headshot.jpg"
  },
  "location": {
    "state": "CT",
    "office_address": "100 Greenwich Ave, Suite 200, Greenwich, CT 06830",
    "service_areas": ["Greenwich", "Darien", "New Canaan", "Westport"]
  },
  "branding": {
    "primary_color": "#3d3028",
    "secondary_color": "#5a4a3a",
    "accent_color": "#b8926a",
    "font_family": "Georgia",
    "logo_url": ""
  },
  "integrations": { "email_provider": "gmail" },
  "compliance": {
    "state_form": "CT-REC-100",
    "licensing_body": "CT Real Estate Commission",
    "disclosure_requirements": [
      "Residential Property Condition Disclosure",
      "Lead-based paint disclosure (pre-1978)",
      "Underground Storage Tank Disclosure"
    ]
  }
}
